{
  "username": "naitik-joshi",
  "identity": {
    "name": "Naitik Joshi",
    "role": "DEVELOPER / BUILDER / AI STUDENT",
    "location": "Kathmandu, Nepal",
    "timezone": "Asia/Kathmandu",
    "node": "KTM-NP-0545",
    "tagline": "building useful and unusual software"
  },
  "current_build": "ProdTag",
  "projects": [
    {
      "name": "ProdTag",
      "repo": "ProdTag",
      "status": "ACTIVE DEVELOPMENT",
      "stack": "GO + WAILS",
      "summary": "Desktop audio cues for terminal commands, designed to make long-running development work easier to follow.",
      "position": "northwest",
      "accent": "mint"
    },
    {
      "name": "Research Hub",
      "repo": "hackathon-neutron",
      "status": "HACKATHON PROTOTYPE",
      "stack": "NEXT + SUPABASE",
      "summary": "An AI-assisted research workspace built for the Islington Hackathon, with researcher tools and a focused CMS.",
      "position": "southwest",
      "accent": "amber"
    },
    {
      "name": "API Escape",
      "repo": "api-escape-platform",
      "status": "COMPLETED TEAM PROJECT",
      "stack": "FASTAPI + DOCKER",
      "summary": "A containerized API learning platform with Groq-assisted workflows, built and presented as a summer team project.",
      "position": "northeast",
      "accent": "cyan"
    },
    {
      "name": "Tab Unloader",
      "repo": "Tab-Unloader",
      "status": "STABLE",
      "stack": "CHROMIUM EXTENSION",
      "summary": "A focused browser utility for unloading inactive tabs and reclaiming memory without losing the session.",
      "position": "southeast",
      "accent": "mint"
    }
  ],
  "fallback_telemetry": {
    "public_repos": 17,
    "followers": 6,
    "stars": 2,
    "latest_repo": "hackathon-neutron",
    "latest_repo_date": "2026-09-13",
    "projects": {
      "ProdTag": {
        "language": "Go",
        "stars": 0,
        "forks": 0,
        "open_issues": 0,
        "pushed_date": "2026-08-27"
      },
      "hackathon-neutron": {
        "language": "TypeScript",
        "stars": 0,
        "forks": 0,
        "open_issues": 0,
        "pushed_date": "2026-09-13"
      },
      "api-escape-platform": {
        "language": "Python",
        "stars": 0,
        "forks": 0,
        "open_issues": 0,
        "pushed_date": "2026-08-24"
      },
      "Tab-Unloader": {
        "language": "JavaScript",
        "stars": 0,
        "forks": 0,
        "open_issues": 0,
        "pushed_date": "2026-05-22"
      }
    }
  }
}
